{
  "schema": 1,
  "id": "galette-complete-fondue-poireau-pommes-de-terre",
  "titre": "Galette bretonne complète ou fondue de poireau et pommes de terre",
  "description": "Galette de sarrasin garnie au choix de chacun : complète (jambon, œuf, fromage), fondue de poireau et/ou pommes de terre.",
  "type": "plat",
  "portions": 4,
  "temps": { "preparation": 15, "cuisson": 40, "repos": 0 },
  "difficulte": "facile",
  "tags": [],
  "ingredients": [
    { "nom": "galette de sarrasin", "quantite": 4, "unite": "piece", "categorie": "frais" },
    { "nom": "jambon blanc", "quantite": 4, "unite": "tranche", "categorie": "frais" },
    { "nom": "œuf", "quantite": 4, "unite": "piece", "categorie": "cremerie" },
    { "nom": "gruyère râpé", "quantite": 150, "unite": "g", "categorie": "cremerie" },
    { "nom": "poireau", "quantite": 4, "unite": "piece", "categorie": "fruits-legumes" },
    { "nom": "crème liquide entière", "quantite": 10, "unite": "cl", "categorie": "cremerie" },
    { "nom": "beurre", "quantite": 30, "unite": "g", "categorie": "cremerie" },
    { "nom": "pomme de terre", "quantite": 800, "unite": "g", "categorie": "fruits-legumes" },
    { "nom": "sel", "quantite": null, "unite": null, "categorie": "epices-aromates", "placard": true },
    { "nom": "poivre", "quantite": null, "unite": null, "categorie": "epices-aromates", "placard": true }
  ],
  "etapes": [
    { "texte": "Éplucher les pommes de terre, les couper en morceaux et les cuire à l'eau bouillante salée.", "minuteur": 20 },
    { "texte": "Laver et émincer finement les poireaux." },
    { "texte": "Faire fondre le beurre dans une poêle, ajouter les poireaux, saler, poivrer et cuire à couvert en remuant.", "minuteur": 15 },
    { "texte": "Ajouter la crème liquide dans la fondue de poireau, mélanger et réserver au chaud." },
    { "texte": "Égoutter les pommes de terre. Chauffer les galettes de sarrasin dans une poêle et garnir chacune selon l'envie : complète (un œuf cassé au centre, jambon et gruyère), fondue de poireau, pommes de terre, ou fondue de poireau et pommes de terre ensemble.", "minuteur": 5 },
    { "texte": "Replier les bords de chaque galette en carré et servir aussitôt. Le choix de la garniture revient à chacun : prévoir les quantités selon les envies de la tablée." }
  ]
}
